{
  "campaign_name": "Baldur's Gate Campaign",
  "setting": "Baldur's Gate - Sword Coast",
  "ruleset": "D&D 5e",
  "tone": "Urban Fantasy, Political Intrigue",
  "source_books_allowed": ["Player's Handbook (SRD 5.1)"],
  "planned_length_sessions": {"min": 6, "max": 10},
  "difficulty": "Normal",
  "max_players": 6,
  "created": "2026-02-08",
  "description": "A campaign set in the bustling city of Baldur's Gate, where intrigue, danger, and opportunity lurk around every corner."
}
